{
  "$schema": "https://json-schema.org/draft/2020-12/schema",
  "$id": "https://runecode.dev/protocol/schemas/objects/GateCheckpointReport.schema.json",
  "title": "GateCheckpointReport",
  "description": "Typed advisory gate lifecycle checkpoint report from untrusted runner to broker.",
  "type": "object",
  "additionalProperties": false,
  "maxProperties": 17,
  "required": [
    "schema_id",
    "schema_version",
    "gate_id",
    "gate_kind",
    "gate_version",
    "gate_attempt_id",
    "lifecycle_state",
    "checkpoint_code",
    "occurred_at",
    "idempotency_key"
  ],
  "properties": {
    "schema_id": { "const": "runecode.protocol.v0.GateCheckpointReport", "description": "Protocol schema identifier.", "x-data-class": "public" },
    "schema_version": { "const": "0.1.0", "description": "Protocol schema version.", "x-data-class": "public" },
    "gate_id": { "type": "string", "pattern": "^[a-z][a-z0-9_]*$", "maxLength": 128, "description": "Stable gate identity.", "x-data-class": "public" },
    "gate_kind": { "type": "string", "enum": ["build", "test", "lint", "format", "secret_scan", "policy"], "description": "Gate taxonomy kind.", "x-data-class": "public" },
    "gate_version": { "type": "string", "pattern": "^[0-9]+\\.[0-9]+\\.[0-9]+$", "maxLength": 32, "description": "Gate contract version.", "x-data-class": "public" },
    "gate_attempt_id": { "type": "string", "minLength": 1, "maxLength": 128, "description": "Gate attempt identity for retry/rerun tracking.", "x-data-class": "public" },
    "lifecycle_state": { "type": "string", "enum": ["planned", "running", "passed", "failed", "overridden", "superseded"], "description": "Gate lifecycle state vocabulary.", "x-data-class": "public" },
    "checkpoint_code": { "type": "string", "enum": ["gate_planned", "gate_started", "gate_passed", "gate_failed", "gate_overridden", "gate_superseded"], "description": "Stable gate checkpoint code.", "x-data-class": "public" },
    "occurred_at": { "type": "string", "format": "date-time", "maxLength": 64, "description": "Checkpoint event time.", "x-data-class": "public" },
    "idempotency_key": { "type": "string", "minLength": 1, "maxLength": 256, "description": "Stable idempotency key for replay safety.", "x-data-class": "public" },
    "run_id": { "type": "string", "minLength": 1, "maxLength": 128, "description": "Run identity when provided in report payload.", "x-data-class": "public" },
    "stage_id": { "type": "string", "minLength": 1, "maxLength": 128, "description": "Stable stage identity when known.", "x-data-class": "public" },
    "step_id": { "type": "string", "minLength": 1, "maxLength": 128, "description": "Stable step identity when known.", "x-data-class": "public" },
    "role_instance_id": { "type": "string", "minLength": 1, "maxLength": 128, "description": "Stable role-instance identity when known.", "x-data-class": "public" },
    "stage_attempt_id": { "type": "string", "minLength": 1, "maxLength": 128, "description": "Stage attempt identity for retry/recovery tracking.", "x-data-class": "public" },
    "step_attempt_id": { "type": "string", "minLength": 1, "maxLength": 128, "description": "Step attempt identity for retry/recovery tracking.", "x-data-class": "public" },
    "details": { "type": "object", "maxProperties": 32, "description": "Optional bounded advisory details.", "x-data-class": "public", "additionalProperties": true }
  }
}
